//9335881002623	Disposable Latex Gloves 100 Pack - Medium	!retired
//9335881002616	Disposable Latex Gloves 100 Pack - Large	!retired
//9420005397737	The Aromatherapy Co. Limited Edition Xmas Pud Body Butter 30ml	!retired
//9312628340019	Melrose Organic Apple Cider Vinegar and Honey 500ml	!retired
//9312628013074	Melrose Health Premium Liquid Coconut Oil 500ml	!retired
//871760001886	Sun Bum Original SPF 30+ Sunscreen Lotion 177ml	!retired
//855111003705	iHealth Align Gluco-Monitoring System	!retired
//9314807076740	Sambucol Immune Everyday 60 Capsules	!retired
//9369999314217	Happy Way Protein & Acai Berry Powder 500g	!retired
//9324525000620	Pentavit Day Care 50ml	!retired
//9314839003097	Ego Moov Head Lice Solution200ml	!retired
//663595929714	WoodWick Woven Comforts Trilogy Medium Candle	!retired
	Love Luna Period Midi Brief Black	!//
	Love Luna Period Full Brief Black	!//
	Love Luna Period Bikini Brief Black	!//
	Love Luna LBL Maternity Brief Black	!//
	Love Luna LBL Midi Brief Black	!//
	Love Luna Period Bamboo Brief Black	!//
//9316774110007	Bonvit Psyllium Husks 200g	!retired
//62781110026	Lacteeze Drops 15.5ml	!retired
//9313312070915	1000 Hour Hair Colour Stain Remover 35ml	!retired
//9316542116866	Natio Aromatherapy Skin Brightening Face Balm 50g	!retired
	Homyped Snug 2 Midnight	!//
	Homyped Fluffy Snug Mauve	!//
	COVID-19 Saliva Test 1 pack	!//
//814892020653	TheraPearl Hot and Cold Neck Wrap	!retired
//9357141010179	Sprout Organic Junior Protein Vanilla Milkshake 660g	!retired
//9338475026562	ApoHealth Sore Throat Lozenges PLUS Anaesthetic 16 Pack	!retired
9312484230875	Scholl Ladies Flight Compression Hosiery Socks Natural Size 8-10 1 Pair	!retired	!//
5038483142844	Scholl Mens Flight Compression Socks Black Size 9-12 1 Pair	!retired	!//
9312484230868	Scholl Scholl Ladies Flight Compression Hosiery Socks Natural Size 6-8 1 Pair	!retired	!//
//5038483142806	Scholl Flight Socks Compression Hosiery Black W6-8 M3-6	!retired
//8809208138193	Skin Republic Gold Hydrogel Biodegradable Face Mask	!retired
//9311770590082	Swisse Ultiboost High Strength Vitamin C Effervescent 60 Tablets	soh>0
//9316100159434	Pharmacy Choice Oral Rehydration Salts 10 Sachets	!retired
//9300607011456	Nicorette 2mg Gum Icy Mint 25 Pieces	!retired
//813103022912	Lovercare Fabric Face Mask For Kids 10 Pack - Navy - Small	!retired
26169059802	Bod Man Black Fragrance Body Spray 236ml	soh>0	!retired	!//
026169051653	Bod Man Most Wanted Fragrance Body Spray 236ml	soh>0	!retired	!//
26169059314	Bod Man Really Ripped Abs Fragrance Body Spray 236ml	soh>0	!retired	!//
26169055231	Bod Man Blue Surf Fragrance Body Spray 236ml	soh>0	!retired	!//
//9358752000009	We The Wild Mini Essential Plant Care Kit	!retired
//8714207410501	Multi-Gyn Active Gel 50ml	!retired
//9310160821553	Berocca Energy Vitamin Mango & Orange Effervescent Tablets 30 pack	!retired
//9300607801798	TYLENOL Paracetamol 500mg 100 Caplets	!retired
//8716569031950	Re-Cycle-Me Pizzeria Craft Projects	!retired
//8716569033213	Re-Cycle-Me Robot World Craft Projects	!retired
//9321582004899	Martin & Pleasance Rest & Quiet Calm Mixed Berry Pastilles 50g	!retired
//9321582006664	Vital All-In-One 600g	!retired
//9312658033004	CEDEL Hair Spray Firm 250g	!retired
//3607345379067	Rimmel Lasting Finish 25hr Foundation - 201 Classic Beige	!retired
//3616301273165	Rimmel The Multi Tasker Concealer - 040 Ivory	!retired
//3616301273172	Rimmel The Multi Tasker Concealer - 050 Sand	!retired
9349228003181	Peppermint Grove Gardenia Candle 60g	!//
//9349228004256	Peppermint Grove Lily & Lotus Flower Diffuser 100ml	!retired
//9350181001237	Protein Supplies Restore Tropical Single Serve 10g	!retired
//9350181001442	Protein Supplies Restore Raspberry Lemonade Single Serve 10g	!retired
//3282770140927	Klorane Shampoo with Mango 100ml	!retired
/3282770144871	Klorane Scalp Detox Shampoo with Aquatic Mint 400ml	visible	soh>0	!//
//074170457773	Sally Hansen Good Kind Pure - 260 Eco Rose	!retired
//3616303242060	Sally Hansen Good Kind Pure - 203 Mystic Topaz	!retired
//074170472073	Sally Hansen Good Kind Pure - 291 Passion Flower	!retired
//3616303242169	Sally Hansen Good Kind Pure - 156 Raisin The Bar	!retired
//9300705605618	Cenovis Men's Multi 100 Capsules	!retired
//3616303242107	Sally Hansen Good Kind Pure - 229 Rock Steady	!retired
/5202236115397	ERRE DUE Creamy Lipstick 539	visible	soh>0	!//
//6935318863327	Zhushi Disposable Surgical mask 10 pack	!retired
/5202236758020	ERRE DUE Perfect Matte Lipstick 802 Confusion	visible	soh>0	!//
//9311633020473	Medispot Cotton Gloves - Large 1 Pair	!retired
//9311633020459	Medispot Cotton Gloves - Small 1 Pair	!retired
//9419844123454	PARA’KITO Kids Wristband Soccer Ball	!retired
//74764638649	Ardell Nail Addict Bordeaux	!retired
//74764638656	Ardell Nail Addict Think Pink	!retired
//74764638717	Ardell Nail Addict Nude Pink	!retired
//076351000310	Color Lux Colour Cleansing Conditioner Cocoa 244ml	!retired
//076351000105	Color Lux Colour Cleansing Conditioner Red 244ml	!retired
//076351000204	Color Lux Colour Cleansing Conditioner Magenta 244ml	!retired
//076351000402	Color Lux Colour Cleansing Conditioner Blue 244ml	!retired
//076351000341	Color Lux Colour Cleansing Conditioner Sangria 244ml	!retired
//076351000327	Color Lux Colour Cleansing Conditioner Lilac 244ml	!retired
//076351000334	Color Lux Colour Cleansing Conditioner Copper 244ml	!retired
//9311676000876	Spectrum Herbal Coraki Chamomile Herbal Cream 50g	!retired
//9311676000883	Spectrum Herbal Coraki Chickweed Herbal Cream 50g	!retired
//792850899926	Burt's Bees Micellar Cleansing Water 3 in 1 Makeup Remover 354.8ml	!retired
//3282770145069	Klorane Shampoo with Peony 200ml	!retired
//5202236187028	ERRE DUE Sheer Lipstick 502 Poison Apple	soh>0
//4021457637706	Lavera Basis Sensitiv Body Lotion Rich 250ml	!retired
//9332402031988	MOR Marshmallow Limited Edition Fragrant Candle 250g	!retired
//9326628031815	Pain Away atheLITE Joint & Muscle Pain Relief Gel 125g	!retired
//5012909006156	Avent Bottle Brush Blue	!retired
//8710103896111	Avent Ultra Air Soother 18+ Months 2 Pack (Assorted Designs/Colours)	!retired
//9312658918677	In Essence ie Mind Trio Set	!retired
//9347902001027	Mr. Bright Charcoal Toothpaste 100g	!retired
//9347902009207	Mr. Bright LED Light Whitening Kit 3 Week Supply	!retired
//9314839019760	Ego etch&ethos Body Wash Botanical Bloom 300g	!retired
//9314839019807	Ego etch&ethos Body Wash Botanical Bloom 1kg	!retired
//9314839019814	Ego etch&ethos Body Wash Summer Citrus 1L	!retired
//9314839019777	Ego etch&ethos Body Wash Summer Citrus 300ml	!retired
//9314839019784	Ego etch&ethos Body Lotion Botanical Bloom 300ml	!retired
//9314839019821	Ego etch&ethos Body Lotion Botanical Bloom 1L	!retired
//9314839019838	Ego etch&ethos Body Lotion Summer Citrus 1L	!retired
//9317368004436	Mount Romance Sandalwood Mosquito Coils 10 Pack	!retired
//9317368004429	Mount Romance Sandalwood Mosquito Sticks 20 Pack	!retired
//ANTIPODES GIFT WITH PURCHASE	ANTIPODES GIFT WITH PURCHASE	soh>0
//ARDELL GIFT WITH PURCHASE	ARDELL GIFT WITH PURCHASE	soh>0
//9353965004899	b.box Teat Stage 3	!retired
//9300701209032	Glen 20 Disinfectant Spray Citrus Breeze 300g	!retired
/5202236187424	ERRE DUE Metallic Lip Gloss 542 Pink	visible	soh>0	!//
//5202236201311	ERRE DUE Power Lash Effect Mascara 101	visible
//9300711087477	Strepsils Plus Blocked Nose Relief Menthol Eucalyptus Lozenges 16 Pack	!retired
//21954474	Mr Jasper Says The Bad Boy Kinda Guy	!retired
//21954443	Mr Jasper Says The Minimalist Kinda Guy	!retired
//21954450	Mr Jasper Says The Nature Lover Kinda Guy	!retired
//21954467	Mr Jasper Says The Suit Kinda Guy	!retired
//93631037	Dettol Classic Antiseptic Liquid 125ml	!retired
//619232003422	Eylure Lash Illusion 301	!retired
//619232003460	Eylure Lash Illusion 305	!retired
//9369999315818	The Base Collective Magnesium Bath Salts 200g	!retired
//7610472872963	Medela Day&Night Duo Soother 0-6m	!retired
//7610472873267	Medela Day&Night Duo Soother 18m	!retired
//7612367040457	Medela Disposable Bra Pads 60 Pack	!retired
//9312658915621	Oil Garden Self Care Skincare Set	!retired
//9310041900889	Aspro Clear 42 Tablets	!retired
//9351644000026	SParms Sun Sleeves White Small	!retired
//9351644000040	SParms Sun Sleeves White Large	!retired
//9333279000534	Larri Oral Reflux Spray 30ml	!retired
9316774133006	Bonvit Prune Juice 750ml	visible	soh>0	!//
//3282779236966	Klorane Shampoo with Quinine and B Vitamins 100ml Travel Size	!retired
//9346710000321	Herbs of Gold Cold & Flu Strike 60 Tablets	!retired
//7612367063159	Medela Safe & Dry Ultra Thin Nursing Pads	!retired
//047144056104	Bausch + Lomb Boston One Step 5ml	!retired
//731788155919	JAX Mens Leakproof Boxer Large	!retired
//9353965010562	b.box 360 Cup Lilac Pop	!retired
//9316542150396	Natio Boost & Curl Lifting Mascara Black	!retired
//5011522154633	Eylure Pro Magnetic Lash System Accent	!retired
//5011522154664	Eylure Pro Magnetic Lash System Volume	!retired
//5011563010844	SIMPKINS Botanical Apple Ginger Drops 150g	!retired
//5011563010820	SIMPKINS Botanical Elderflower Drops 150g	!retired
//5011563010837	SIMPKINS Botanical Rose Drops 150g	!retired
//787099573904	BASE SOAP Exfoliating Mintwood Bar Soap 120g	!retired
//787099573874	BASE SOAP Geranium & Pink Clay Bar Soap 120g	!retired
//4042809307665	JOBST Men Casual Medical Compression Socks 15-20	!retired
//9312658919063	Oil Garden 3-In-1 Ultrasonic Diffuser	!retired
//9322316008510	P'ure Papayacare Baby Vapour Balm 25g	!retired
//786411188611	The Heart Centred Herb Company Pine Needle + Pure 14 Tea Bags	!retired
//7610313415175	A.VOGEL Echinaforce Cold & Flu Hot Drink Syrup 100ml	!retired
///9313818140624	Henry Blooms Herbalax Capsules 200 Cap	soh>0
//4042809307689	JOBST Men Casual Medical Compression Socks 15-20 Black Large	!retired
//4042809307702	JOBST Men Casual Medical Compression Socks 15-20 Black Extra Large	!retired
//50051105773	Lip Smacker Lippy Pals Swirl Unicorn Frosting	!retired
//50051103885	Lip Smacker Lippy Pals Swirl Straw-Ma Llama Berry	!retired
//50051808445	Lip Smacker Lippy Pals Kitten Water-Meow-Lon	!retired
//7618900964150	Mavala Mini Nail Color 415 Pushy Purple	!retired
//9356586000646	Synxplus Shoe Deodoriser Mist 150ml	!retired
//787099573911	BASE SOAP Shampoo Bar 120g	!retired
//787099574314	BASE SOAP Lemon Myrtle Hand Wash 1 Litre Refill	!retired
//764302280026	Shea Moisture Raw Shea Butter Hydrating Body Wash 384 mL	!retired
9310460103410	Lady Jayne Metallic Blush Textured Bobby Slides 10341	visible	!//
9310460110258	Lady Jayne Claw Grip 11025	visible	soh>0	!//
//9310460170191	Lady Jayne Metal Ponytail Cuff 17019	!retired
//9310460170818	Lady Jayne Large Metallic Slides 17081 6 Pack	!retired
//9310460170825	Lady Jayne Thick Round Barrettes 17082 2 Pack	!retired
9310460171518	Lady Jayne SIR Hair Tie 17151	visible	!//
//9310460110234	Lady Jayne Scrunchie Navy 17156	!retired
//9351383002718	Boody Brazilian Bikini Nude - Medium	!retired
//9351383002725	Boody Brazilian Bikini Nude - Large	!retired
//9351383002664	Boody Brazilian Bikini Black - Small	!retired
//9351383002671	Boody Brazilian Bikini Black - Medium	!retired
//9351383012380	Boody Brazilian Bikini Light Grey Marl - Small	!retired
//9351383012328	Boody Full Briefs Light Grey Marl - Extra Small	!retired
//9351383022778	Boody LYOLYTE G-String Powder Pink - Medium	!retired
//9351383022297	Boody LYOLYTE Hi-Cut Bikini Storm - Medium	!retired
//9351383022419	Boody LYOLYTE Hi-Cut Bikini Powder Pink - Medium	!retired
//9351383022471	Boody LYOLYTE Hipster Bikini Storm - Medium	!retired
//9351383022488	Boody LYOLYTE Hipster Bikini Storm - Large	!retired
//9351383022594	Boody LYOLYTE Hipster Bikini Powder Pink - Medium	!retired
//9340447026043	Boody Mens Boxers Charcoal - Large	!retired
//9351383012137	Boody Mens Boxers Light Grey Marl - Extra Large	!retired
//9351383017606	Boody Mens Everyday Long Boxers Black - Medium	!retired
//7350075691904	The Humble Natural Toothpaste Tablets Fluoride 60 Pack	!retired
//3600541744431	Garnier Micellar Cleansing Water In Oil 400ml	!retired
//9314057017678	DermaVeen Moisture Bright Eye Cream 15ml	!retired
//9314057017692	DermaVeen Face Regenerating Night Cream 50ml	!retired
//9342050009611	Living Healthy Vitamin D 1000IU 120 Capsules	!retired
//9348918001940	Freshwater Farm Lemon Myrtle Oil + Manuka Honey Body Bar 200g	!retired
//9348918001018	Freshwater Farm Rosewater + Pink Clay Body Bar 200g	!retired
//9348918009410	Freshwater Farm Lemon Myrtle Oil + Manuka Honey Castile Hand Wash 500ml	!retired
//9348918000912	Freshwater Farm Rosewater + Pink Clay Castile Hand Wash 500ml	!retired
//9348918000936	Freshwater Farm Mandarin + Cedarwood Castile Hand Wash 500ml	!retired
//9348918009618	Freshwater Farm Hemp Seed Oil Castile Body Wash 500ml	!retired
//9348918009670	Freshwater Farm Rosewater + Pink Clay Castile Body Wash 500ml	!retired
//7618900964204	Mavala Prismatic 420 Flower Light	!retired
//7618900964235	Mavala Prismatic 423 Pink Light	!retired
//663595762519	WoodWick Bakery Cupcake Ellipse Candle	!retired
//3282770145120	Klorane Anti-Yellow Organic Centaury Conditioner 200ml	!retired
//3282770145236	Klorane Anti-Yellow Organic Centaury Shampoo 200ml	!retired
//3282770145311	Klorane Ultra Gentle Conditioner With Oat 200ml	!retired
//9329221210731	Manicare maniPRO 2-in-1 Cuticle Pusher & File 21073	!retired
//9329221223670	Manicare Glam Xpress 73 Mia-Louise Lash Kit 22367	!retired
//9329221223809	Manicare Glam Hydro Lash 80 Hailey 22380	!retired
//9329221223878	Manicare Dual Brow Styler 22387	!retired
//9329221230357	Manicare Facial Cleansing Brush 23035	!retired
//7613036045865	Optifast VLCD Lemon Dessert 53g x 8	!retired
//643517960025	The Milk Pantry White Choc & Macadamia Cookie Mix 400g	!retired
//643517960049	The Milk Pantry Choc Chip Cookie Mix 400g	!retired
//758475515399	The Milk Pantry Mumma Milk Shakes Vanilla 300g	!retired
//6009710205860	Truly Pure Intense Smoothing Retinol Ampoule 4ml	!retired
//9325024009503	Dateline FX Aluminium Hair Grip 48mm 12in Green	!retired
//9352570000791	Medescan Hearing Aid In Ear	!retired
//9369999068752	Happy Way Protein De Ja Brew Coffee Protein Powder 500g	!retired
//9351906001372	Happy Way Charge Up Pineapple 300g	!retired
//9352570000784	Medescan Hearing Aid Behind Ear	!retired
//9311262071600	Key Sun SIA Tinted Hair Wax 100ml - Blue	!retired
//9311262071631	Key Sun SIA Tinted Hair Wax 100ml - Purple	!retired
//9311262071655	Key Sun SIA Tinted Hair Wax 100ml - Yellow	!retired
//9331927003999	Life Space Probiotic Powder For Children 60g	!retired
//9345207000554	BodiSure Cushion Massager	!retired
9321582002901	Harmony Menopause Day & Night 90 Tablets & 45 Tablets Bonus	visible	!//
//716237187888	Giovanni 100% Pure Castor Oil 250ml	!retired
//9347832000633	S26 Gold Alula Progress 6 – 12 Months 900g	!retired
//9347832000657	S26 Alula Gold Toddler 900g	!retired
//9310045950255	Glen 20 Spray Disinfectant Original Scent 300g	!retired
//9338817024065	Glasshouse Fragrances Body Cream Sunsets in Capri 200g	!retired
	Maseur Invigorating Massage Sandal Black (7 sizes)	!//
//50051803341	Lip Smacker Lip Balm Tsum Tsum TinkerB	!retired
//50051804256	Lip Smacker Lip Balm Tsum Tsum Elsa	!retired
//50051803303	Lip Smacker Lip Balm Tsum Tsum Olaf	!retired
//50051808049	Lip Smacker Lip Balm Tsum Tsum Ariel	!retired
//842879000954	DesignMe  Gloss Me Hydrating Conditioner 300ml	!retired
//842879000985	DesignMe Gloss Me Hydrating Treatment Mask 250ml	!retired
//842879000022	DesignMe Puff Me Volumizing Conditioner 300ml	!retired
//842879000008	DesignMe Bounce Me Curl Balm 250ml	!retired
//842879000947	DesignMe Gloss Me Hydrating Shampoo 300ml	!retired
//842879000213	DesignMe Quickie Me Dry Shampoo For Dark Tones 339ml	!retired
//842879000206	DesignMe Quickie Me Dry Shampoo For Light Tones 339ml	!retired
//842879000152	DesignMe Quickie Me Dry Shampoo Foam 189ml	!retired
//9300607517262	Carefree Barely There Unscented Panty Liners 24 Pack	!retired
//9300607535365	Stayfree Regular Sanitary Pads With Wings 14 Pack	!retired
//074764586414	Ardell Nail Addict Eco Mani Pink Ombre Press On Nails	!retired
//074764586377	Ardell Nail Addict Eco Mani French Natural Ombre Press On Nails	!retired
//074764586421	Ardell Nail Addict Eco Mani Violet Press On Nails	!retired
//9421904510579	Aotearoad Zinki Stick Arctic White	!retired
//9421904510586	Aotearoad Zinki Stick Arctic Blue	!retired
//9343723006630	Nutra Organics Organic Captain Calm Bubblegum 200g	!retired
//4001638529952	Weleda Shower Bar Ylang Ylang + Iris 75g	!retired
//842879000282	DesignMe Gloss Me Hair Serum 75ml	!retired
//842879000015	DesignMe Puff Me Volumizing Shampoo 300ml	!retired
//842879000053	DesignMe Puff Me Volumizing Volumizing Cloud Mist 9.1g	!retired
//842879000084	DesignMe Puff Me Volumizing Volumizing Powder 9.1g	!retired
//842879000169	DesignMe Fab Me Leave in Treatment 230ml	!retired
9300673840813	Panadol Extra with Optizorb Pain Relief 40 Caplets	!retired	!//
9300673839114	Panadol with Optizorb Paracetamol Pain Relief Tablets 500mg 50 tablets	!retired	!//
9300673838773	Panadol with Optizorb Paracetamol Pain Relief Tablets 500mg 20 tablets	!retired	!//
//7618900964099	Mavala Nail Mini 409 Star Palace	!retired
//9338817025147	Glasshouse Night Before Christmas Fragrance Diffuser 250ml	!retired
//9338817027066	Glasshouse Fragrances A Night Before Christmas Car Diffuser	!retired
//9420005407306	The Aromatherapy Co. Festive Favours LE Candle 100g Golden Caramel	!retired
//9420005407658	The Aromatherapy Co. Therapy Man Charcoal Body Bar Sea Salt & Sandalwood 225g	!retired
//9420005407429	The Aromatherapy Co. Festive Favours LE 80ml Diffuser Summer Berries	!retired
//9420005407559	The Aromatherapy Co. Therapy Candle Collection 50g*6 Pack	!retired
//070942304573	GUM Flosbrush Automatic Applicator (Assorted Colours - Picked at random)	!retired
//070942507240	Gum Menthol Orthodontic Wax	!retired
//9337896003824	BioCeuticals Ultra Potent-C® 200g Oral Powder	!retired
//9346777002030	Love Tea Kapha Pyramid Tea Bags 60g	!retired
//9346777001996	Love Tea Vata Pyramid Tea Bags 60g	!retired
//93551533	The Base Collective Little Organic Sleep Spray Chamomile & Lavender Spray 125ml	!retired
//9337896003497	BioCeuticals InNatal® Plus Iron 60 Capsules	!retired
//5034279001654	Holdsworth Christmas Bee Friendly Vegan Box 110g	!retired
//9352218001692	Noosa Basics Lip Balm Trio (Paw Paw / Coconut / Cherry)	!retired
//9344949001294	Bio Island Milk Calcium Bone Care 150 Softgel Capsules	!retired
//9300607180114	Codral Relief Max Strength Hot Drink Lemon Flavoured 10 Sachets	!retired
//5010724544358	Batiste Plant Powered Dry Shampoo Coconut Milk & Hemp Seed Oil 200ml	!retired
//3282770144741	Klorane Repairing Shampoo With Organic Cupuacu 200ml	!retired
//9359054000162	Muscle Nation Protein Jelly Powder Raspberry 30g	!retired
//9333544007732	White Magic Eco Basics Soap Riser Assorted Color	!retired
9300673818027	Panadol Mini Caps for Pain Relief, Paracetamol 500mg 48 Caplets	!retired	!//
9300673839626	Panadol Paracetamol Pain Relief 500mg 100 Tablets	!retired	!//
//680248510426	Oriental Botanicals Cold & Flu 60 Tablets	!retired
9338689002932	Bubs & Co Baby Teething Gel 15g (Please note expiry End September 2023)	!retired	!//
//810020173574	Bondi Sands Skin Firming Gradual Tanning Lotion 150ml	!retired
//3023672020203	Domaine Lumiere Dinner Candle 7 Hrs Moss Green Single	!retired
//3023672020609	Domaine Lumiere Dinner Candle 7 Hrs Granny Smith Single	!retired
//9300631017974	Disprin Max 500mg  16 Tablets	!retired
//9311262071990	Key Sun Zinke Clear Mineral SPF 50+ 500g	!retired
//731509799552	KISS Gel Fantasy Sculpted Nails - 4 The Cause	!retired
//731509799569	KISS Gel Fantasy Sculpted Nails - Back It Up	!retired
//731509804652	KISS Magnetic Lash Double Strength Crowd Pleaser	!retired
//9311262000365	Key Sun Clear Zinke Sensitive SPF50 100g	!retired
//9369998089499	Jonny Vegan Condoms Let's Dance 30 Pack	!retired
//074764646880	Ardell Active Lashes Speedy 1 Pair	!retired
//9350299005318	Chemists' Own Cough, Cold & Flu Relief PE 24 Capsules (S2)	!retired
//9314057018040	Difflam Plus Anaesthetic Sore Throat Lozenges Berry 32 Value Pack	!retired
//9351383020200	Boody Motivate 3/4 High-Waist Dark Olive Tights Medium	!retired
//9351383020354	Boody Motivate 5" High-Waist Dark Olive Shorts Medium	!retired
//9351383021283	Boody Racerback Sports Bra Dark Olive Small	!retired
//9351383017682	Boody Women's Active Muscle Tank Top Black Small	!retired
//9351383017705	Boody Women's Active Muscle Tank Top Black Large	!retired
//9351383000400	Boody Racerback Active Tank Black Small	!retired
//9351383000417	Boody Racerback Active Tank Black Medium	!retired
//5060074626365-E	Atkins Low Carb 37g Day Break Bar - Chocolate Chip Crisp 5 pack (Best before 22 December 2023)	!retired
5060691440597-E	Atkins Day Break Nutrition Bars - Sea Salt Caramel Crisp Bars 37g x 5 Pack (Best before date 27 October 2023)	!retired	!//
5060691440566-E	Atkins Caramel Chocolate Nut Roll 5pk (BEST BEFORE 28 April 2023)	!retired	!//
5060074633516-E	Atkins Endulge Milk Choc 30g 5 Pack (BEST BEFORE 27 MAY 2023)	!retired	!//
//9314057018293	Difflam Sore Throat Lozenge Dual Action Honey & Lemon Flavour Value Pack 32 Lozenges	!retired
//9332402033180	MOR Purple Rain Marshmallow Body & Home Trio 1 pack	!retired
//9316542150549	Natio Cherish Gift Set	!retired
//9338817028575	Circa Home Lily & Rosewood Soy Candle 350g Limited Edition	!retired
//9338817028209	Glasshouse Fragrances Body Bar Trio (Limited Edition) 3*95g	!retired
//9300711600782	Strepsils Soothing Sore Throat Lozenges Honey and Lemon 48 Pack	!retired
//074170458039	Sally Hansen Good Kind Pure Nail Polish - Clear	!retired
/7613287000118	Sustagen Hospital Formula 840g Caramel	soh>0	!retired	!//
//9353354000792	BioGenesis Natural Australia (Travel Friendly) Organic Barley Grass Powder 150g	!retired
//5015278373447	Museums And Galleries Wallet in Artforms in Nature	!retired
//9353354004493	BioGenesis Natural Australia (Travel Friendly) Organic Ocean Plant Calcium 700mg 110 Vegan Capsules	!retired
5011522002293	Eylure Naturals Lashes #020	!retired	!//
//9333725001146	Jomeis Fine Foods Hoodles Healthy Instant Noodles Braised Beef Cup 60g	!retired
//9333725001153	Jomeis Fine Foods Hoodles Healthy Instant Noodles Roast Chicken Cup 60g	!retired
//9333725001160	Jomeis Fine Foods Hoodles Healthy Instant Noodles Vegetable Hotpot Cup 60g	!retired
//9356583000199	Bioderma Sensibio Rinse-Free All Stars Cleansing Duo	!retired
//9310208082380	Handy Crepe Bandage Medium White 7.5cm x 1.6m	!retired
//4042809591668	Leukoplast Leukomed Absorbent Plus 5 Pack - 5 x 7.2cm	!retired
//4042809591781	Leukoplast Leukomed T Plus Waterproof Dressing 5cm X 7.2cm 5 Pack	!retired
//9300607563245	Neutrogena Hydro Boost Hyaluronic Acid Water Gel Refill 50g	!retired
//9331927003425	Life Space Probiotics + Menopause Support 30 Capsules	!retired
//190446347675	DonJoy Marvel Kids Arm Sling Avengers XS Youth 28cm arm length	!retired
//9342320057687	Nude By Nature Creamy Matte Lipstick 10 Aubergine 2.75 g	!retired
//9322837007023	MicrOrganics Green Nutritionals Mountain Organic Spirulina 500 Tablets	!retired
//9359873000060	Hough Iron Levels Home Test 2 Pack	!retired
//9359873000046	Hough Vitamin D Home Test 2 Pack	!retired
//4005800196959	Elastoplast 48734 Ultra Sensitive Silicone Soft 8 Pack	!retired
//4005800262173	Elastoplast 48768 Kids Plasters 20 Pack	!retired
//9400581051780	Nutra-Life ProBiotica High Potency 30 Capsules	!retired
//9326431721378	Mirenesse Hand Renew Treatment Gloves with 15 Golden Oils 100g	!retired
//735850943343	GelPro Hydrolysed Collagen Tablets for Hair Health 30 Tablets	!retired
//9314839006863	Ego QV Face Purifying Mask 75g	!retired
//9349268000461-E	Bioglan Medlab Immune-5 Vanilla Powder 150g (Expiry Date 25/07/23)	!retired
9300607210101	Johnson's Baby Powder 100g New	!retired	!//
//9325740024828	Skin Doctors SD White & Bright Treatment Cream 50ml	!retired
//7750075044791	Kativa Hair Straightening Kit Capillary	!retired
//9300711221826	Strepfen Intensive Throat Spray with Anti Inflammatory Action 15mL	!retired
//9333800001610	Henry Blooms Probiotic Mouthwash Peppermint Ultra Sensitive 375ml	!retired
//21911026	The Jojoba Company Ultimate Night Cream 50mL	!retired
//754590176842	HiSmile V34 Colour Corrector Foam 45ml	!retired
//754590176736	HiSmile VIO405 Teeth Whitening Kit 21mL	!retired
9338817030486	Glasshouse Fragrances Moon and Back Scented Candle 380g	soh>0	!retired	!//
//9332402013311	MOR Belladonna Body Butter 50g	!retired
7317400020594	TePe Toothbrush Good Compact Soft	!retired	!//
5060074621704-E	Atkins Protein Shake Mix Chocolate Flavour 330 gm (Please Note Best Beore 17/11/23)	!retired	!//
637480010559-E	Atkins Endulge Caramel Nut Chew Bars 5pk (Please note Best Before 02 December 2023	!retired	!//
9338817030004	Glasshouse Fragrances Festival of Lights Christmas Candle 380g	soh>0	!retired	!//
9338817029992	Glasshouse Fragrances Gingerbread House Candle 380g	soh>0	!retired	!//
9338817030035	Glasshouse Fragrances White Christmas Soy Candle 380g	soh>0	!retired	!//
9338817030059	Glasshouse Fragrances Night Before Christmas Candle 760g	soh>0	!retired	!//
/5060074621728-E	Atkins Protein Shake Mix Vanilla Flavour 330g (Please note tub has been dented - product still Sealed)	!retired	!//
