//853218006032	Slip Silk Pillowcase-Standard/Queen (6 shades) Colour	!//
//609613848025	Slip Silk Pillowcase-Standard/Queen (6 shades) Colour	!//
//853218006247	Slip Silk Pillowcase-Standard/Queen (6 shades) Colour	!//
//853218006018	Slip Silk Pillowcase-Standard/Queen (6 shades) Colour	soh>0	!//
//853218006056	Slip Silk Pillowcase-Standard/Queen (6 shades) Colour	!//
//853218006094	Slip Silk Pillowcase-Standard/Queen (6 shades) Colour	!//
//853218006674	Slip Silk Skinny Scrunchies Black	!retired
//853218006704	Slip Silk Large Scrunchies - Mixed	!retired
//732013301507	Neostrata Resurface Foaming Glycolic Wash 125mL	!retired
//732013301057	Neostrata Resurface Glycolic Renewal Serum 30mL	!retired
//732013301552	Neostrata Resurface Lotion Plus 200mL	!retired
//732013301477	Neostrata Skin Active Cellular Restoration 50g	!retired
//732013301484	Neostrata Skin Active Intensive Eye Therapy 15g	!retired
//9338661001656	Natural Instinct Anti-dandruff Conditioner 250ml	!retired
//9338661001649	Natural Instinct Anti-dandruff Shampoo  250ml	!retired
//9338661001595	Natural Instinct Daily Hydrating Conditioner 250ml	!retired
//9338661001588	Natural Instinct Daily Hydrating Shampoo 250ml	!retired
	Happy Way Shaker 400ml	!//
//9351906000061	Happy Way Smooth Operator Salted Caramel Protein Powder 500g	!retired
//9420005375544	The Aromatherapy Co. Relax Lavender & Clary Sage Candle 260g	!retired
//9420005381804	The Aromatherapy Co. Unwind Coconut & Water Flower Diffuser 250ml	!retired
//9420005375773	The Aromatherapy Co. Sweet Lime & Mandarin Hand & Body Lotion 500ml	!retired
//9420005375810	The Aromatherapy Co. Lavender & Clary Sage Hand & Body Lotion 500ml	!retired
//9420005375766	The Aromatherapy Co. Lavender & Clary Sage Hand & Body Wash 500ml	!retired
//9420005375933	The Aromatherapy Co. Strength Sandalwood & Cedar Hand Cream 75ml	!retired
//9420005376398	The Aromatherapy Co. Man Sandalwood & Sea Salt Hand & Body Lotion 500ml	!retired
9336022002618	Ecoya Guava & Lychee Sorbet Madison Jar 400g	!//
9336022006623	Ecoya Lotus Flower Madison Jar 400g	!//
//9336022002632	Ecoya Guava & Lychee Sorbet Mini Madison Jar 80g	!retired
//9336022001857	Ecoya Lotus Flower Mini Madison Jar 80g	!retired
9336022002526	Ecoya French Pear Mini Diffuser 50ml	soh>0	!//
//9349228002801	Peppermint Grove Freesia & Berries Candle 350g	!retired
9349228002825	Peppermint Grove Gardenia Candle 350g	!//
	Peppermint Grove Patchouli & Bergamot Candle	!//
	Medela Personal Fit Flex Breast Shield 2pc	!//
	Natural Rubber Soother Twin Round Soother	!//
	Natural Rubber Soother Single Round Soother	!//
//9312059473027	Curash Baby Care Anti-Rash Baby Powder 100g	!retired
	Curash Baby Care Fragrance Free Baby Wipes	!//
//9312059473034	Curash Family Powder Medicated Anti-Rash 100g	!retired
//9338608002722	BabyU Disposable Change Mats 10pk	!retired
	BabyU Goat Milk Wipes	!//
//9349915000257	EM's for Kids Baby Earmuffs Colour	!//
//9349915000066	EM's for Kids Baby Earmuffs Colour	soh>0	!//
	EM's for Kids Earmuffs	!//
//9336127000007	Wotnot Biodegradable Nappy Bags 50pk	!retired
	Pigeon Calming Soother Small/0-3 months	!//
	Pigeon SofTouch Peristaltic PLUS Teats 2pc 0-9+ months	!//
	Haakaa Generation 3 Silicone Baby Bottle 160ml	!//
//9334604000533	Rite Aid Hydrogel Breast Discs 12pk	!retired
	Rainbow Stacker & Teether Toy	!//
	Cloud Teether	!//
	Jellies Panda Teether	!//
	Jellies Koala Teether	!//
	Bepanthen Antiseptic Soothing Cream	!//
//3056560101203	Sophie the Giraffe Teething Colour Rings	!retired
//3056562201291	Sophie the Giraffe So Pure Birth Gift Set	!retired
	Cetaphil Baby Gentle Wash & Shampoo	visible	soh>0	!//
//3504105034412	Mustela Cradle Cap Cream 40ml	!retired
//3504105035396	Mustela Multi-Sensory Bubble Bath 200ml	!retired
//9311262010104	Hair Nutrition Argan Shampoo with Coconut Oil & White Tea Extract 300ml	!retired
//9314807017705	Food For Your Hair Men's 30 Capsules	!retired
//9341709000528	Kintra Foods Formosan Green Tea 32pk	!retired
//074305318054	Bragg Nutritional Yeast Seasoning 127ml	!retired
//9348082010021	Every Bit Organic Aloe Vera Gel 100ml	!retired
//9348082010113	Every Bit Organic Argan Oil 50ml	!retired
//9314807042516	Nature's Way Kids Smart Vita Gummies Omega-3 + Multi 50c	!retired
9314807064754	Nature's Way Kids Smart Multi + Iron Liquid 200ml	visible	soh>0	!//
//9314807070779	Nature's Way Beauty Collagen Mature Skin Gummies (40 Gummies)	!retired
//9314807066703	Nature's Way Adult Vita Gummies Omega-3 (110 Gummies)	!retired
	Nature's Way Kids Smart Vita Gummies Multi-Vitamin + Vegies	!//
//792850016804	Burt's Bees Intense Hydration Cream Cleanser 170g	!retired
//792850894693	Burt's Bees Tinted Lip Balm 4.25g (6 shades) Colour	soh>0	!//
//792850894723	Burt's Bees Tinted Lip Balm 4.25g (6 shades) Colour	soh>0	!//
//792850894716	Burt's Bees Tinted Lip Balm 4.25g (6 shades) Colour	soh>0	!//
//792850894730	Burt's Bees Tinted Lip Balm 4.25g (6 shades) Colour	soh>0	!//
//792850894747	Burt's Bees Tinted Lip Balm 4.25g (6 shades) Colour	!//
//792850894709	Burt's Bees Tinted Lip Balm 4.25g (6 shades) Colour	soh>0	!//
	Medela Contact Nipple Shields	!//
//853218006667	Silk Large Scrunchies Black	!retired
9332402016060	MOR Marshmallow Eau De Parfum 100ml	visible	soh>0	!//
//182505000089	Rosebud Salve Tube Lip Balm 14.2g	!retired
//9343723001383	Nutra Organics Golden Latte (Turmeric & Manuka Honey - Ayurvedic Chai) 90g	!retired
//9369998047888	Beauty Shake 100% Pure Marine Collagen Size	!//
//9329224001992	Dermal Therapy Little Bodies Eczema Relief Cream 56g	!retired
	Neat Feat Sport High Impact Stabiliser Insole 1 Pair (2 sizes)	!//
	Neat Feat Spur Pads (2 sizes)	visible	soh>0	!//
	Sock Shop IOMI Footnurse Gentle Grip Diabetic Ladies Socks 3 Pack	!//
	Lavera All-Round Cream	!//
//4021457475339	Toothpaste Complete Care Fluoride-Free 75ml	!retired
//9421017761721	Trilogy Rosehip Oil Antioxidant+ 30ml	!retired
//9317039002440	Summer's Eve Intimate Wash Daily Freshness with Aloe & Prebiotics 237ml	!retired
//9317039002457	Summer's Eve Ultra Fresh Intimate Wash with Aloe & Prebiotics 237ml	!retired
//9347597000428	Eco Tan Super Acai Exfoliator 100ml	!retired
	Pregnosis Early In-Stream Pregnancy Test	!//
//9313501003137	Pregnosis Dip & Read Early Detection Pregnancy Test Size	!//
//854049002477	Acure Seriously Soothing SPF Day Cream 50ml	!retired
	Coccyx Flat Cushion	!//
	Mark II	!//
//9400581047790	Musashi Fat Metaboliser with Carnitine 60 Capsules	!retired
//9400581047806	Musashi Intra Workout Watermelon Flavor 350g	!retired
	Protein Wafer Bar 40g	!retired	!//
	Musashi Shred & Burn Bar 60g	!//
	Young Athlete Protein 360g	!//
//9318329125184	A'kin Lifting Eye Cream 15ml	!retired
//9349288141274	A'kin Australian Desert Lime & Sweet Orange Natural Roll-On Deodorant 65ml	!retired
//9349288140598	A'kin Nourishing Cream Cleanser & Toner 140ml	!retired
//9349288141175	A'kin Rose & Australian Sandalwood Roll-On Deodorant 65ml	!retired
//9318329010558	A'kin Mild & Gentle Fragrance Free Shampoo 500ml	!retired
	A'kin Daily Shine Avocado & Calendula Conditioner	!//
//9349288130872	A'kin Volumising Shampoo 500ml	!retired
	Ego SunSense Daily Face SPF 50+	!//
	Ego SunSense Junior SPF 50+	!//
	Ego SunSense Sensitive Visible Screen SPF 50+	!//
	Bondi Sands Pure Self Tan Foaming Water 200ml	visible	soh>0	!//
//9369998016822	Lover's Dozen Condoms 13 Pack	!retired
//9352417000427	Ultra Thin Condoms 10 Pack	!retired
	Iberogast Digestive Relief Herbal Liquid	!//
//9403067129003	Lifestream Vegan Omega 3 45 Capsules	!retired
//934926800010	Medlab Biotic Jnr 60g	!retired
9349268000034	EnBiotic 60 Capsules (Store in Fridge Click and Collect Only)	visible	soh>0	!//
9349268000027	MultiBiotic 30 Capsules (Store in Fridge Click and Collect Only)	visible	soh>0	!//
//9349268000188	Medlab W8Biotic Strawberry & Cream Flavour 350g	!retired
//9321582001294	Martin & Pleasance All Natural Calendula Cream Size	!//
//9324294001255	Martin & Pleasance Sleep Relief Spray 25g	!retired
//9320870938397	Spa Trends Aloe Vera Konjac Towel	!retired
//9320870938366	Spa Trends Konjac Aloe Vera Sponge	!retired
//9320870927551	Spa Trends Facial Brush	!retired
	Bass Brushes The Green Brush with Bamboo Pins & Bamboo Handle	visible	soh>0	!//
//74764622150	Ardell Magnetic Lash Singles - Demi Wispies	!retired
//74764758910	Ardell Nail Addict Premium Artificial Nail Set - Matte Blue	!retired
//731509734942	KISS Blowout Lash - Pageboy	!retired
//5000488107067	Spatone Original Liquid Iron Size	!//
//9316120185758	Brauer Baby & Child Teething Gel 20g	soh>0
//9316120273400	Kids Liquid Iron with Vitamin B 200ml	soh>0
	Brauer Calm Oral Liquid 200ml	!//
//9316120059608	Brauer ArnicaEze Arnica Gel 100g	!retired
	Oral 7 Moisturising Mouthwash	!//
	One A Day Multi Nutrient Tablets	!//
	Pro Collagen One A Day Capsules	!//
9329771000844	ReDormin Forte 30 Tablets	visible	soh>0	!//
//9312146008361	Thompson's One-A-Day Vitex 1500 60 Capsules	!retired
//9316754102091	Plunkett's Vita E Pure Vitamin E Oil 25ml Tube	!retired
9300701542146	Bonjela Mouth Ulcer & Teething Gel 15g	!retired	!//
93262170	Bonjela Teething & Mouth Ulcer Gel 15g	!retired	!//
9300673839794	Panadol Optizorb Paracetamol 500mg 96 caplets	!retired	!//
	Bioderma Atoderm Creme	!//
	Bioderma Atoderm Intensive Balm	!//
//3401346673274	Bioderma Sensibio Soothing Rich Cream 40ml	!retired
//3401360106994	Bioderma Sebium Sensitive 30ml	!retired
	Nutra-Life Kyolic Aged Garlic Extract	!//
//4001638523103	Weleda Calendula Nappy Change Cream 30ml	!retired
3433422406599	La Roche Posay Toleriane Dermo-Cleanser 200ml	visible	soh>0	!//
//3337875482585	La Roche Posay Uvidea BB Cream 30ml Colour	!//
//9338817011577	Glasshouse Fragrances Diving Into Cyprus Soy Candle Sea Salt & Saffron 60g	!retired
//9338817011829	Glasshouse Fragrances Flower Symphony Soy Candle White Rose & Pear Blossom 380g	visible
//9319912035361	Bronchodual Cough Syrup 200ml	soh>0
	Cote Noire Luxury Range Hydrangeas - Crystal Vase (2 options)	!//
	Cote Noire Herringbone Flower - Clear Vase	soh>0	!//
	Cote Noire Luxury Grand Bouquet (3 options)	!//
	Cote Noire Perfumed Natural Touch Rose Bud - Clear Vase (3 options)	!//
	Cote Noire Perfumed Natural Touch Single Rose - Clear Vase (3 options)	!//
	Cote Noire Perfumed Natural Touch 5 Roses - Clear Vase (3 options)	!//
9332402017265	MOR Marshmallow Eau De Parfum 50ml	!//
	JSHealth Protein + Probiotics 450g	visible	soh>0	!//
//9332402029572	MOR Petite Petals Floral Hand Cream Trio	!retired
	Domaine Lumier Birthday Candles 20 Pack	!//
	Domaine Lumiere Copper Pillar Candle	!//
22165862	Garnier-Thiebaut Cacaoyer En Pot Vert Tea Towel	visible	!//
//9323307090033	Makeup Erasing Pads 3 Pack	!retired
	MOR Tender Buds Gift Set	!//
	Caruso's Fluid Away	visible	soh>0	!//
	Caruso's Pain-Algesic For Joints	!//
//9323573007650	Caruso's Total Beauty Collagen 60 Tablets	!retired
	Henry Blooms Kids Probiotic Toothpaste	!//
	Difflam Plus Anaesthetic Sore Throat Lozenges 16s (3 Flavours)	visible	soh>0	!//
//9314057009192	Chesty Cough Forte 24 Tablets	!retired
9300673923936	Panadol Mini Caps for Pain Relief, Paracetamol 500mg 20 Caplets	!retired	!//
//9355449000052	Bunjie Bubble Bath 300ml	!retired
//9355449000014	Bunjie Born To Be Mild Top To Toe Wash 300ml	!retired
//0617201734766	Black Blaze Column Pillar Candle Duo Cream White	!retired
//617201734810	Black Blaze Column Pillar Candle Duo Grey	!retired
//663595929677	WoodWick Trilogy Coastal Sunset Seaside Mimosa Island Coconut	!retired
//708002100741	Faith In Nature Aloe Vera Soap 100g	!retired
//3282770204971	Avène Antirougeurs UNIFY SPF30 40ml	!retired
//3282779069519	Avène Cicalfate Restorative Skin Cream Size	!//
//9342963005137	Avène Lip Balm with Cold Cream 4g	!retired
//3282779051514	Avène Gentle Milk Cleanser 200ml	!retired
//3282770049312	Avène PhysioLift Smoothing Day Cream 30ml	!retired
//3282770110753	Avène PhysioLift Smoothing Plumping Serum 30ml	!retired
	Avène Mineral Tinted Compact Cream SPF50	!//
//9319629107733	Revitanail Conditioning Nail Polish Remover Wipes 30 Pack	!retired
//9352284000803	Louvelle Brigitte Peach Blossom & Honey Hair & Body Oil 100ml	!retired
//716237185815	Giovanni 2chic Ultra-Moist Hair Hydration Treatment 51ml	!retired
//716237185822	Giovanni 2chic Ultra-Revive 3-in-1 Hair Revival Treatment 51ml	!retired
//3282770107739	Klorane Shampoo with Peony 400ml	!retired
//3282779131445	Klorane Conditioner with Mango Butter Size	!//
//3282770075472	Klorane Conditioner with Mango Butter Size	!//
	Klorane Conditioner with Flax Fiber	!//
//3282770106381	Klorane Shampoo with Mango Butter Size	!//
//3282770106596	Klorane Shampoo with Mango Butter Size	!//
//9327693000324	Sukin Signature Hand and Nail Cream Pump 125ml	soh>0
//9342749004361	Clean Lean Protein Powder 500g (2 Flavours) S[Flavour]	soh>0	!//
//9342749004354	Clean Lean Protein Powder 500g (2 Flavours) S[Flavour]	!//
//9342749004699	Kids Good Stuff Multinutrient Smoothie Mix (3 Flavours) S[Flavour]	!//
//9312658500117	ie Hayfever Essential Oil Roll On 10ml	!retired
//9312658500490	In Essence Motivate Pure Essential Oil Blend 8ml	!retired
//9312658500506	In Essence Meditate Pure Essential Oil Blend 8ml	!retired
//9312658617273	In Essence White Mini USB Ultrasonic Diffuser	!retired
//9325334024630	Bodichek Small Gel X Sport Heat/Cold Pack	!retired
//9325334017267	Bodichek Two Section Rectangle Wheat Bag	!retired
//9317222000567	EpZen Soothe Feet Magnesium Soak 450g	!retired
	Pelvi Leakproof G-String Underwear Beige	!//
	Pelvi Leakproof Full Brief Underwear Beige	!//
	Pelvi Menstrual Cup	visible	soh>0	!//
//9346710000581	Herbs of Gold Children's Magnesium Care 60 Chewable Tablets	!retired
//9313923061098	Herbs of Gold Ultra Zinc + 60 Capsules	!retired
//9325344003021	Libra Girl Regular Tampons 16 Pack	!retired
//9369999608651	TSUNO Organic Cotton Tampons (16 Tampons) Type	!//
//9353740000054	SALT BY HENDRIX COCO-SOAK Bath Soak 220g Scent	!//
//9353740000139	Salt by Hendrix BODY POLISH - Grapefruit & Vanilla 250g	!retired
//9353740000689	Salt by Hendrix Crystal Waters Hyaluronic Face Mask 40ml	!retired
	Natural Rubber Soother Twin Orthodontic	!//
	Ethical Nutrients Immune Defence	!//
	Ethical Nutrients Mega Magnesium 60 Tabs	visible	soh>0	!//
	Ethical Nutrients Mega Magnesium Powder 200g	soh>0	!//
	Ethical Nutrients Mega Zinc 40mg with Vitamin C Powder 95g	!//
	Ethical Nutrients High Strength Omega-3	visible	soh>0	!//
	Inner Health Immune Booster Kids	visible	soh>0	!//
//9310488023134	Centrum Kids Incremin Iron Mixture Cherry 100ml Oral Liquid	!retired
//9349228004898	Peppermint Grove Vanilla Caramel Candle 60g	!retired
//9349228004904	Peppermint Grove Vanilla Caramel Diffuser 100ml	!retired
//9421033251558	Hemptuary Hemp Infused Moisturiser 100g (Please note Expiry End December 2023)	!retired
//628110550514	Malarkey Kids Munch-It Blanket Sunshine	!retired
	Malarkey Kids Chew Cube	!//
//9314807076788	Nature's Way Adult Vita Gummies Collagen Beauty Complex 50 pastilles	!retired
//9341975000093	Victor Professional Super Rigid Strapping Tape 38mm x 13.7metres (1 roll)	!retired
	Comvita Manuka Honey Lozenges with Propolis- Lemon & Honey	soh>0	!//
//859754005942	Colour Changing Hot & Cold Sports Pack	!retired
//9314889620244	New Beginnings Aqua Gel Breast Pads 16 Pack	!retired
	DonJoy Aircast A60 Stabiliser Ankle Brace	soh>0	!//
	DonJoy Marvel Kids Arm Sling (4 prints)	!//
	DonJoy Advantage Comfort Wrist Brace Marvel (2 prints)	!//
	DonJoy Ergoform Thumb Immobiliser	!//
	DonJoy Fortilax Elastic Knee Brace	!//
	DonJoy Immostrap Back Brace	!//
	DonJoy Quick-Fit Wrist Brace	!//
	DonJoy Rotulax Elastic Knee Support Open Patella	!//
	DonJoy Stabilax Hinged Elastic Knee Brace	!//
	DonJoy Elastic Figure 8 Ankle Strap	!//
//9317222000109	Magnesium Power Magnesium Chloride Flakes 500g	!retired
	RockTape Blister Kit	soh>0	!//
//38472001867	RockBalls Infinity	!retired
//609465218939	RockTape 5MX5CM (16 shades) Colour	!//
//799418005980	RockTape Rock  Balls - Textured & Smooth Red	!retired
//38472001843	RockBand Flex Size	!//
//38472001850	RockBand Flex Size	!//
//9350181004511	Botanika Blends Dreamy Jelly - Grape Bubblegum 70g	!retired
//746935313784	Macro Mike Chocolate Chip Pancake Mix 300g	!retired
	Macro Mike Peanut Butter Cheezecake Plant Based Protein 520g	!//
	Elastoplast Antibacterial Waterproof Plaster	!//
	Elastoplast Antibacterial Sensitive Plaster	!//
//9325334024647	Bodichek Gel X Sport Heat & Cold Pack- Medium	!retired
	Nature’s Gold Tinted Lip Balm with Manuka Honey 5g	!//
//3282770208245	Avène A-Oxitive Night Peeling Cream 30ml	!retired
	FUTURO Custom Fit Stabilizing Wrist Brace	!//
	pHisohex Anti-Bacterial Wash	!retired	!//
	Just For Men Shampoo-In Haircolour Light Brown (4 Shades)	!//
764302231547	Shea Moisture Manuka Honey & Yoghurt Hydrate + Repair Conditioner 384ml	visible	soh>0	!//
//71164333075	Keratin Protection Smoothng Deep Conditioner 50g	!retired
21935817	Best Chilblains Treatment	visible	!//
	Gloves Vinyl Clear Powder Free 100 pack (2 sizes)	!//
	Proguard Gloves Vinyl Powder Free Exam 100 pack (3 sizes)	!//
	Gloves Medical Examination Nitrile Powder Free 100 pack	!//
//9350299005905	Lanate Face & Body Cream 150g	!retired
//9349689000460	Pearlbe Emu Oil Cream 200ml	soh>0
//9336022018220	Ecoya French Pear Fragranced Room Spray 110ml	!retired
//4010160053781	Silicea Toothpaste With Collodial Silica 50ml	!retired
//9349780000291	Biostuff Gloves Biodegradable and Compostable Disposable Kitchen - Medium	!retired
	Ego QV Face Moisturising Day Cream	visible	soh>0	!//
//9335931000333	Footsies Tranquility Foot Patches 4 Patches	!retired
//9351568000027	SkinB5 Acne Control Cleansing Mousse 150ml	!retired
//9351568000010	SkinB5 Extra Strength Acne Control Vitamins 60 Tablets	!retired
9300607375916	Neutrogena T/Gel Daily Control 2-in-1 200ml	!retired	!//
//9300631732099	E45 Itch Recovery Moisturising Lotion 250ml	!retired
//9300631537434	E45 Moisturising Lotion 200ml	!retired
//5030147572301	Blue Stratos Soap On A Rope 160g	!retired
//76271100138	Black Flowery Disposable Nail File	!retired
	Barbers Choice Mens Facial Hair Colouring 3 Capsule Kit	!//
//052800673007	Aveeno Oat Milk Blend Shampoo 354ml	!retired
//9420005375506	The Aromatherapy Co. Uplift Sweet Lime & Mandarin Candle 260g	!retired
9300605083967	Musashi Shaker Bottle 600ml	visible	!//
//9400581047738	Musashi SHRED & BURN Vanilla Milkshake Flavour Powder 900ml	!retired
//8809153102430	Skinfood Cabbage Sous Vide Sheet Mask 1 Pack	!retired
//8809153102454	Skinfood Kale Sous Vide Sheet Mask 1 Pack	!retired
//8809153102478	Skinfood Pumpkin Sous Vide Sheet Mask 1 Pack	!retired
//8809153102485	Skinfood Eggplant Sous Vide Sheet Mask 1 Pack	!retired
//8809153102515	Skinfood Skinfood Asparagus Sous Vide Sheet Mask 1 Pack	!retired
//9312146010951	Thursday Plantation Sleep Support & Calming Lavender Roll On 9ml	!retired
//889013	Thursday Plantation Tea Tree Oil Size	!//
	Dr Browns Options Narrow Neck Anti-Colic Baby Bottle with Level 1 Teat	!//
//72239304969	Dr Browns Narrow Teat 2 Pack Level	!//
//72239304952	Dr Browns Narrow Teat 2 Pack Level	!//
//72239304945	Dr Browns Narrow Teat 2 Pack Level	!//
//9300710003027	Euky Bear Tummy Ease Essential Oil Blend 15ml	!retired
//3282770142044	Klorane Purifying Treatment Mask Powder with Organic Nettle & Clay 8 Pack	!retired
//9351791001341	Bisolvon Cough Relief + Relax & Calm 200ml	soh>0
5010724537374	Flawless Beauty Fridge	visible	!//
//9343518002410	X50 Green Tea + Resveratrol Tropical 30 Pack	!retired
//9331927003982	Life-Space Triple Strength Probiotic Powder 30g	!retired
//9331927004002	Life-Space Children Immune Support Probiotic 60g	!retired
	Tonymoly Clean Dew Foam Cleanser 180ml	!//
	Tonymoly Dr. Logy Mask Sheet	visible	soh>0	!//
	Tonymoly Fresh To Go Mask Sheet	!//
	Tonymoly I'm Gel Eye Patch	!//
//8806194035789	I'm Lovely Peach Foot Mask	!retired
	Tonymoly I'm Sheet Mask	!//
	Tonymoly Master Lab Snail Mask Sheet	!//
	Tonymoly Vital Vita 12 Ampoule	!//
//027275400014	Auromere Sandal-Turmeric Ayurvedic Soap with Neem 78g	!retired
//27275200058	Auromere Ayurvedic Cardamom-Fennel Toothpaste 117g	!retired
//9312657400005	The Natural Family Co Bio Cornstarch Soft Toothbrush 2 Pack - Rivermint & Monsoon Mist	!retired
//9312657400135	The Natural Family Co Whitening Toothpaste 100g	!retired
//854178000023	Crush & Brush Toothpaste Tablets - Mint 80 Tablets	!retired
//854178000184	Nelson Naturals Crush & Brush Toothpaste Tablets - Mint Charcoal 80 Tablets	!retired
//9340217000365	Seremind Lavender Oil Capsules 28 Pack	!retired
//9356155000305	JSHealth Pure Marine Collagen + 90g Oral Powder	!retired
	Piksters Kink Piksters 8 Pack (Variant Sizes)	!//
//8056746070083	Curasept SoftTouch Medical Toothbrush (Colours selected at random)	!retired
//8056746070090	Curasept SoftLine Maxi Soft Toothbrush 010	!retired
//4005800249044	Elastoplast Sport Cold Spray 125ml	!retired
//4005800183263	Elastoplast Sport Hi-Stretch Support & Compression Bandage 10cm x 7m	!retired
//9331456000018	Before 15 Dose 30 Capsules	!retired
//9300710001030	Bosistos Eucalyptus Solution 250ml	!retired
//7350075690044	Humble Brush Bamboo Toothbrush Soft Adult White	!retired
//79625075144	EcoTools 7514 Jade Roller Duo	!retired
//79625075298	EcoTools 7529 Jade Roller & Gua Sha Duo	!retired
//731509766974	KISS Manicovery Recovery Care Kit	!retired
//9312657300183	Jack N' Jill Everyday Hand Wash Serenity 300ml	!retired
//9312657201114	Jack N' Jill Bio Toothbrush Monkey	!retired
//9312657011096	Jack N' Jill Natural Toothpaste Milkshake 50g	!retired
736473101110	Bass Brush Bamboo Medium Paddle Shape	visible	soh>0	!//
//9325024002979	Tropical Shine Nail File 707336 - Zebra	!retired
//9415991232216	Red Seal Sweet Dreams Tea 25 Teabags	!retired
//062600961211	Aveeno Daily Moisturising Body Wash 59ml	!retired
7618900912069	Mavala Nail Mini 206 French Cancan	visible	!//
//7618900910720	Mavala Nail Mini 072 Nice	!retired
//7618900909809	Mavala Nail Mini 980 Mykonos	!retired
7618900909939	Mavala Nail Mini 993 Windsor	visible	soh>0	!//
//9319629000102	Dr LeWinn's Private Formula Firming Eye Cream 30g	!retired
//9347802000045	Révive Cracked Heel Gel Socks	!retired
7350012554286	BioGaia Protectis Baby Drops - Gut Comfort 5ml	visible	!//
//3525722026642	Color & Soin 1N Ebony Black 135ml	!retired
//3525722026697	Color & Soin 5M Light Mahogany Chestnut 135ml	!retired
//794712345152	Regrow Derma Roller - Women	!retired
//728238762346	We Are Feel Good Inc. Sensitive Sunscreen Lotion SPF 50+ 75ml	!retired
	Sock Shop IOMI Footnurse Kids Cushion Foot Diabetic Socks Size 12.5-3.5 3 Pack (2 colours)	!//
//074170472400	Sally Hansen Good Kind Pure - 375 Mint Refresh	!retired
//7618900911222	Mavala Nail Mini 122 Tadoussac	!retired
//80687356195	Louvelle Face Lovers - Makeup Removal Pads	!retired
//706502702830	Louvelle Glow Glove - Body Exfoliating Glove	!retired
//302128199353	Raw Medicine Shrooms 4 Immune 50g	!retired
//3701129804452	Bioderma Sensibio Soothing Defensive Moisturiser 40ml	!retired
//9421027311084	Earthwise Baby Bubble Bath Jungle Fruits 275ml	!retired
//70501111222	Neutrogena Bright Boost Illuminating Serum 30mL	!retired
//9300607561067	Neutrogena Neutrogena Oil-Free Pink Grapefruit Cleanser 175mL	!retired
//9300607562309	Neutrogena Hydro Boost Water Gel Lotion SPF 50	!retired
//9300607562613	Neutrogena Hydro Boost Hydrating Facial Gel Mist 100mL	!retired
//93551779	Neutrogena Hydro Boost Sleeping Mask 10mL	!retired
//70501062401	Neutrogena Moisturiser Combination Skin 118mL	!retired
//70501054000	Neutrogena Moisturiser Sensitive Skin 118mL	!retired
//9300607561760	Neutrogena Rapid Wrinkle Repair Night 29mL	!retired
//9300607562552	Neutrogena Rapid Wrinkle Repair Retinol Oil 30ml	!retired
//731509691177	KISS Gel Fantasy Nails - No Pressure	!retired
//9312658915430	Oil Garden Candy Cane Bauble	!retired
//9312658915447	Oil Garden Christmas Tree Bauble	!retired
//871760008021	Sun Bum Baby Bum Born To Explore Travel Set	!retired
//85805425234	Elizabeth Arden Eight Hour Cream Skin Protectant 50ml	!retired
//85805032999	Elizabeth Arden Eight Hour Cream Intensive Moisturising Hand Treatment 75ml	!retired
//85805152147	Elizabeth Arden Eight Hour Cream Nourishing Lip Balm with Sunscreen 15ml	!retired
//9322219027793	Remington Precision Haircut Kit	!retired
//9322219027021	Remington Jet Setter 2000 Hair Dryer	!retired
736658547511	Wet Brush Pro Detangler Vivid Dreams - Courageous Coral	visible	!//
736658598186	Wet Brush Shower Flex Detangling Brush - Purple	visible	!//
736658598155	Wet Brush Shower Flex Detangling Brush - Pink	visible	!//
736658543216	Wet Brush Exfoliating Scalp Brush - Coral	visible	!//
736658543155	Wet Brush Exfoliating Scalp Brush - Lavender	visible	!//
//93552226	Cancer Council Kids Sunscreen SPF50+ 35ml	!retired
//93564366	Cancer Council Raspberry Lip Balm SPF50+ 15g	!retired
//9321299800142	Cancer Council Sensitive + Zinc Sunscreen SPF50+ 75ml	!retired
//9321299102239	Cancer Council Sport Sunscreen SPF50+ 110ml	!retired
//810020171648	Bondi Sands Self Tanning Face Mist 1 Hour Express 70ml	!retired
//9314839017438	Ego QV Gentle Shampoo 500g	!retired
//9314839017391	Ego QV Gentle Conditioner 500g	!retired
//9314839017421	Ego QV Nourishing Shampoo 500g	!retired
//9314839017407	Ego QV Nourishing Conditioner 500g	!retired
//9353740002713	Salt by Hendrix  Tea Time Baby Coco Mojito	!retired
//79625042061	Real Techniques Brush, Blend Brow Kit	!retired
//663595930802	WoodWick Crimson Berries Candle - Large	!retired
//663595931755	WoodWick Frasier Fir Candle - Large	!retired
//663595921756	WoodWick Frasier Fir Candle - Medium	!retired
//663595930529	WoodWick Warm Wool Candle - Large	!retired
//663595920520	WoodWick Warm Wool Candle - Medium	!retired
//079625031980	EcoTools Brighter Tomorrow Better Blends Ahead Set	!retired
//9325024022793	Lash Me - Eyelashes Taryn	!retired
4719003940041.00	Microlife Ear Hygienic Probe Covers 40 Pack	visible	!//
//9421904070066	d3 Riced Neoprene Compression Strap	!retired
